{
  "schema_version": 1,
  "criteria_version": "2026.07-proposta.1",
  "status": "PROPOSTO",
  "per_category": [
    {"category": "POSTE", "minimum_precision": "0.90", "minimum_recall": "0.90"},
    {"category": "ESTRUTURA_MT", "minimum_precision": "0.80", "minimum_recall": "0.80"},
    {"category": "ESTRUTURA_BT", "minimum_precision": "0.80", "minimum_recall": "0.80"},
    {"category": "CABO", "minimum_precision": "0.85", "minimum_recall": "0.85"},
    {"category": "EQUIPAMENTO", "minimum_precision": "0.80", "minimum_recall": "0.80"}
  ],
  "thresholds": {
    "minimum_relation_precision": "0.80",
    "minimum_relation_recall": "0.80",
    "maximum_extraction_failure_rate": "0.05",
    "maximum_latency_p95_ms": "30000",
    "maximum_python_peak_memory_bytes": 536870912,
    "maximum_human_divergence": "0.15"
  },
  "geometry_matching": {
    "point_tolerance": "0.02",
    "polyline_tolerance": "0.015",
    "minimum_area_iou": "0.50"
  }
}
